Cluster,Persona,Retention Strategy
0,C - Data-Capped Digitals,"Upsell this group on unlimited data plans, content bundles, and exclusive streaming offers."
1,A - Premium Loyal Customers,"Reward this high-value segment with exclusive loyalty perks, early upgrades, and VIP service options."
2,E - Churn-Risk New Users,"Target with contract lock-in incentives, personalized upgrade bundles, and retention-specific offers."
3,B - Balanced Bundle Seekers,Offer customized streaming & data bundles with loyalty rewards and value-added upgrades.
4,D - Legacy Phone-Only Users,Target with Internet bundles and a digital education campaign to boost ARPU.
